{
  "$schema": "https://json-schema.org/draft/2020-12/schema",
  "$id": "https://vexil-lang.org/release/rationales/vexil-runtime-ts-0-4-1.json",
  "schemaVersion": "1.0",
  "recordKind": "release-unit-version-rationale",
  "rationaleId": "vexil-runtime-ts-0-4-1",
  "unitId": "vexil-runtime-ts",
  "previousPackageVersion": {
    "kind": "initial-non-release-baseline",
    "version": null,
    "reason": "No prior published package version is established here; tags, changelogs, lockfiles, registry observations, and milestones are not substituted as a baseline."
  },
  "proposedPackageVersion": "0.4.1",
  "changeClass": "initial-source-version",
  "affectedSurfaces": [
    {"namespace": "language-spec", "surface": "Vexil language grammar and semantics", "authorityPath": "spec/vexil-spec.md", "authorityRevision": "24a4d906d36e75c86e7d556ff07a093aa807b96c", "compatibility": "compatible", "assertion": "source-compatibility-assessment", "languageStatus": "draft"},
    {"namespace": "package-api", "surface": "@vexil-lang/runtime package API", "authorityPath": "packages/runtime-ts/package.json", "authorityRevision": "24a4d906d36e75c86e7d556ff07a093aa807b96c", "compatibility": "compatible", "assertion": "source-compatibility-assessment", "languageStatus": "not-applicable"},
    {"namespace": "wire-format", "surface": "Vexil wire schema", "authorityPath": "schemas/vexil/schema.vexil", "authorityRevision": "24a4d906d36e75c86e7d556ff07a093aa807b96c", "compatibility": "compatible", "assertion": "source-compatibility-assessment", "languageStatus": "not-applicable"}
  ],
  "compatibilityEvidenceIdentity": "sha256:18e5560ad3c9b99d30c2e3b24fc3f451c8b91bb0e98c1eb6a889894b2de509b4",
  "dependencyImpact": {"classification": "none", "affectedUnitIds": [], "rationale": "This structural rationale does not infer release ordering, candidate tags, or Release Set membership."},
  "supportMatrix": {
    "claims": [
      {"platform": "Node.js", "languageVersion": "20", "compatibility": "supported", "evidenceIdentity": "sha256:18e5560ad3c9b99d30c2e3b24fc3f451c8b91bb0e98c1eb6a889894b2de509b4"}
    ],
    "boundary": "each supported claim requires its own evidence identity"
  },
  "packageStewardReview": {"actorId": "github:furkanmamuk", "roleId": "package-steward", "assignmentId": "assignment-package-steward-runtime-ts-2026-07-14", "reviewedAt": "2026-07-24T00:00:00Z"},
  "publicCompatibilityDecision": null,
  "releaseBoundary": "structural-rationale-only"
}
